{
  "hitbox_spec_version": "hitbox_v1",
  "from_mesh": "cow_brown_farm_v1.glb",
  "unit": "meter",
  "up": "z",
  "world_metrics": {
    "height_world": 1.62,
    "footprint_radius_world": 0.42,
    "eye_height_world": 1.43,
    "unit": "meter"
  },
  "collision_capsule": {
    "radius_world": 0.42,
    "height_world": 1.62,
    "note": "Gameplay capsule captures broad cow body volume; horns and tail sit within torso/head bounds."
  },
  "regions": {
    "head": {
      "id": 1,
      "aabb_min": [
        0.42,
        -0.17,
        1.02
      ],
      "aabb_max": [
        0.86,
        0.17,
        1.5
      ]
    },
    "torso": {
      "id": 2,
      "aabb_min": [
        -0.72,
        -0.28,
        0.58
      ],
      "aabb_max": [
        0.58,
        0.28,
        1.36
      ]
    },
    "arms": {
      "id": 3,
      "aabb_min": [
        0.08,
        -0.23,
        0.0
      ],
      "aabb_max": [
        0.34,
        0.23,
        1.04
      ]
    },
    "legs": {
      "id": 4,
      "aabb_min": [
        -0.32,
        -0.23,
        0.0
      ],
      "aabb_max": [
        -0.1,
        0.23,
        1.0
      ]
    }
  },
  "hitmask_note": "Front legs are mapped to region `arms` and hind legs to `legs` to preserve four-region contract compatibility."
}