{
  "hitbox_spec_version": "hitbox_v1",
  "from_mesh": "red_dragon_v1.glb",
  "unit": "meter",
  "up": "z",
  "world_metrics": {
    "height_world": 8.6,
    "footprint_radius_world": 4.2,
    "eye_height_world": 6.25,
    "unit": "meter"
  },
  "collision_capsule": {
    "radius_world": 2.1,
    "height_world": 8.6,
    "note": "Broad collision capsule covering a large grounded dragon."
  },
  "regions": {
    "head": {
      "id": 1,
      "aabb_min": [
        3.1,
        -0.7,
        4.3
      ],
      "aabb_max": [
        5.9,
        0.7,
        6.9
      ]
    },
    "torso": {
      "id": 2,
      "aabb_min": [
        -3.2,
        -1.15,
        1.45
      ],
      "aabb_max": [
        3.1,
        1.15,
        5.05
      ]
    },
    "arms": {
      "id": 3,
      "aabb_min": [
        0.2,
        -4.0,
        1.0
      ],
      "aabb_max": [
        3.7,
        4.0,
        6.3
      ]
    },
    "legs": {
      "id": 4,
      "aabb_min": [
        -2.1,
        -1.35,
        0.0
      ],
      "aabb_max": [
        2.8,
        1.35,
        3.05
      ]
    }
  },
  "hitmask_note": "Wings and forelegs are grouped under arms; hindlegs under legs; tail and main trunk under torso."
}